{
  "schemaVersion": 2,
  "id": "safety-acquire-bus",
  "title": "Safety Authority: peerless CAN error path (normal mode) - Degraded -> Fault(DegradedTimeout) -> ErrorPassive -> force-stop",
  "type": "behavior",
  "phase": "L4",
  "identity": {
    "board": {
      "part": "STM32F405RG",
      "uid": "002900363033470336363131"
    }
  },
  "flash": {
    "required": true,
    "env": "firmware"
  },
  "readback": {
    "addr": 536944640,
    "words": 122,
    "windowS": 65,
    "rules": [
      {
        "name": "magic",
        "offset": 0,
        "kind": "eq",
        "expect": 1396786737,
        "note": "0x53414631 'SAF1' - live production SafetyDiag struct"
      },
      {
        "name": "version",
        "offset": 1,
        "kind": "eq",
        "expect": 1,
        "note": "SafetyDiag struct version (v1)"
      },
      {
        "name": "health_fault",
        "offset": 4,
        "kind": "eq",
        "expect": 3,
        "note": "health = Fault (3) after T_deg 60s in motion-capable Degraded (CH_F NACK)"
      },
      {
        "name": "fault_degraded_timeout",
        "offset": 6,
        "kind": "eq",
        "expect": 1,
        "note": "fault = DegradedTimeout (1); CanFailsafe guarded (health already Fault)"
      },
      {
        "name": "t_deg_accumulated",
        "offset": 10,
        "kind": "delta",
        "minDelta": 50000,
        "note": "degraded_motion_ms low word grew >= 50s: T_deg 60s accumulation honored"
      },
      {
        "name": "stops_issued",
        "offset": 16,
        "kind": "delta",
        "minDelta": 1,
        "note": "Controlled stop emitted on Fault (Fault at rest -> CONTROLLED, #45 sec 4); continuous re-emission (D6)"
      },
      {
        "name": "force_stops_issued",
        "offset": 17,
        "kind": "delta",
        "minDelta": 1,
        "note": "ErrorPassive reached on peerless bus -> FORCE-STOP intent (D5)"
      },
      {
        "name": "can_tx_count",
        "offset": 18,
        "kind": "delta",
        "minDelta": 1,
        "note": "CAN emission happened (zero/force-stop frames on failing bus)"
      },
      {
        "name": "intent_force_stop",
        "offset": 12,
        "kind": "eq",
        "expect": 131330,
        "note": "current_intent word = 0x00020102: kind=2(ForceStop) source=1(Safety) profile=2(ForceStop)"
      }
    ]
  }
}
